{
  "$schema": "../../schemas/extension-v1.schema.json",
  "schemaVersion": 1,
  "id": "subagent-policy-local",
  "displayName": "Subagent Policy",
  "description": "Adds policy presets and concurrency/depth controls to Copilot's native /subagents UI.",
  "visibility": "private",
  "requires": {
    "afterburner": ">=0.1.0 <1.0.0",
    "copilotCli": [">=1.0.84-4"]
  },
  "runtime": {
    "entrypoint": "runtime/extension.mjs",
    "execution": "in-process"
  },
  "capabilities": ["application-source-transform"]
}
