{
  "$schema": "../../schemas/extension-v1.schema.json",
  "schemaVersion": 1,
  "id": "copilot-openai",
  "displayName": "Copilot OpenAI Bridge",
  "description": "Exposes the active Copilot session model catalog through a localhost OpenAI-compatible API when enabled.",
  "visibility": "private",
  "requires": {
    "afterburner": ">=0.1.0 <1.0.0",
    "copilotCli": [">=1.0.83-1 <1.0.84"]
  },
  "runtime": {
    "entrypoint": "runtime/extension.mjs",
    "execution": "in-process"
  },
  "capabilities": ["canvas"],
  "sessionExtension": {
    "entrypoint": "com.github.copilot/extensions/CopilotOpenAI/extension.mjs"
  }
}
